{
  "metadata": {
    "caseId": "quick-002",
    "caseTitle": "The Silent Gavel",
    "gamePackageVersion": "0.1.0",
    "caseBoardSchemaVersion": "1.0",
    "sourceSeedFile": "games/quick-002-the-silent-gavel/case-board-seed.json",
    "createdAt": "2026-06-27T00:00:00-04:00",
    "lastUpdatedAt": "2026-06-28T00:00:00-04:00",
    "lastUpdatedTurn": 1,
    "playerVisibleOnly": true
  },
  "knownFacts": [
    {
      "factId": "fact-gavel-missing",
      "summary": "The ceremonial gavel was reported missing from the locked display niche in Judge Harrow's chambers.",
      "source": "opening report",
      "turnDiscovered": 0,
      "confidence": "reported",
      "refs": { "clueIds": [], "npcIds": [], "locationIds": ["loc-judge-chambers"], "objectIds": ["object-display-niche"], "evidenceIds": [], "imageIds": [] }
    },
    {
      "factId": "fact-reception-setting",
      "summary": "The loss was discovered during a short courthouse reception.",
      "source": "opening report",
      "turnDiscovered": 0,
      "confidence": "reported",
      "refs": { "clueIds": [], "npcIds": [], "locationIds": ["loc-judge-chambers"], "objectIds": [], "evidenceIds": [], "imageIds": [] }
    },
    {
      "factId": "fact-three-staff-access",
      "summary": "Only three regular staff members had practical access to the chambers during the reception.",
      "source": "opening report",
      "turnDiscovered": 0,
      "confidence": "reported",
      "refs": { "clueIds": [], "npcIds": ["char-miriam-vale", "char-roland-pierce", "char-elias-quill"], "locationIds": ["loc-judge-chambers"], "objectIds": [], "evidenceIds": [], "imageIds": [] }
    },
    {
      "factId": "fact-front-lock-intact",
      "summary": "The front lock is intact and smooth, making a forced front entry unlikely.",
      "source": "display niche inspection",
      "turnDiscovered": 1,
      "confidence": "observed",
      "refs": { "clueIds": ["clue-intact-front-lock"], "npcIds": [], "locationIds": ["loc-judge-chambers"], "objectIds": ["object-display-front-lock"], "evidenceIds": ["evidence-display-niche"], "imageIds": [] }
    },
    {
      "factId": "fact-loose-display-backing",
      "summary": "The display backing shifts slightly, and its waxed edge looks freshly handled.",
      "source": "close inspection of display niche",
      "turnDiscovered": 1,
      "confidence": "observed",
      "refs": { "clueIds": ["clue-loose-backing"], "npcIds": [], "locationIds": ["loc-judge-chambers"], "objectIds": ["object-display-backing"], "evidenceIds": ["evidence-display-niche"], "imageIds": [] }
    }
  ],
  "evidence": [
    {
      "evidenceBoardId": "evidence-display-niche-board",
      "evidenceId": "evidence-display-niche",
      "clueId": null,
      "title": "Locked display niche",
      "descriptionKnownToPlayer": "The front lock is intact, but the rear backing shifts slightly and its waxed edge looks freshly handled.",
      "foundAtLocationId": "loc-judge-chambers",
      "foundAtObjectId": "object-display-niche",
      "status": "inspected",
      "interpretationStatus": "partial",
      "turnDiscovered": 1,
      "playerNotes": "The gavel likely was not removed by forcing the front lock. The backing may be another access route."
    }
  ],
  "knownNPCs": [
    {
      "npcBoardId": "npc-miriam-vale",
      "npcId": "char-miriam-vale",
      "name": "Miriam Vale",
      "roleKnownToPlayer": "senior clerk",
      "status": "met",
      "knownClaims": [],
      "knownContradictions": [],
      "lastKnownLocationId": "loc-judge-chambers",
      "turnFirstKnown": 0
    },
    {
      "npcBoardId": "npc-roland-pierce",
      "npcId": "char-roland-pierce",
      "name": "Roland Pierce",
      "roleKnownToPlayer": "junior barrister",
      "status": "met",
      "knownClaims": [],
      "knownContradictions": [],
      "lastKnownLocationId": "loc-judge-chambers",
      "turnFirstKnown": 0
    },
    {
      "npcBoardId": "npc-elias-quill",
      "npcId": "char-elias-quill",
      "name": "Elias Quill",
      "roleKnownToPlayer": "court archivist",
      "status": "met",
      "knownClaims": [],
      "knownContradictions": [],
      "lastKnownLocationId": "loc-judge-chambers",
      "turnFirstKnown": 0
    }
  ],
  "suspects": [
    {
      "suspectBoardId": "suspect-miriam-vale",
      "npcId": "char-miriam-vale",
      "name": "Miriam Vale",
      "status": "possible",
      "apparentMotive": "Unknown so far.",
      "apparentOpportunity": "Had practical access as senior clerk; her exact position during the reception remains untested.",
      "evidenceFor": [],
      "evidenceAgainst": [],
      "openQuestions": ["Where was she during the reception?", "Did her duties or keys give access to the display backing?"],
      "refs": { "clueIds": [], "npcIds": ["char-miriam-vale"], "locationIds": ["loc-judge-chambers"], "objectIds": [], "evidenceIds": [], "imageIds": [] }
    },
    {
      "suspectBoardId": "suspect-roland-pierce",
      "npcId": "char-roland-pierce",
      "name": "Roland Pierce",
      "status": "possible",
      "apparentMotive": "Unknown so far.",
      "apparentOpportunity": "Had access during the reception; his exact movements remain untested.",
      "evidenceFor": [],
      "evidenceAgainst": [],
      "openQuestions": ["Where was he during the key interval?"],
      "refs": { "clueIds": [], "npcIds": ["char-roland-pierce"], "locationIds": ["loc-judge-chambers"], "objectIds": [], "evidenceIds": [], "imageIds": [] }
    },
    {
      "suspectBoardId": "suspect-elias-quill",
      "npcId": "char-elias-quill",
      "name": "Elias Quill",
      "status": "possible",
      "apparentMotive": "Unknown so far.",
      "apparentOpportunity": "Had access during the reception; his exact movements remain untested.",
      "evidenceFor": [],
      "evidenceAgainst": [],
      "openQuestions": ["What was he doing at the shelves?"],
      "refs": { "clueIds": [], "npcIds": ["char-elias-quill"], "locationIds": ["loc-judge-chambers"], "objectIds": [], "evidenceIds": [], "imageIds": [] }
    }
  ],
  "clearedSuspects": [],
  "locations": [
    {
      "locationBoardId": "loc-judge-chambers-board",
      "locationId": "loc-judge-chambers",
      "name": "Judge Harrow's chambers",
      "status": "available",
      "descriptionKnownToPlayer": "A paneled office with a display niche, judge's desk, sideboard, shelves of ledgers, corridor door, and tea service.",
      "openQuestions": ["Where is the gavel now?", "Who could use or reach the display backing?"]
    }
  ],
  "visitedLocations": [
    {
      "visitBoardId": "visit-judge-chambers",
      "locationId": "loc-judge-chambers",
      "name": "Judge Harrow's chambers",
      "turnFirstVisited": 0,
      "turnLastVisited": 1,
      "notablePlayerVisibleFindings": [
        "The display niche stands open and the gavel is missing.",
        "The front lock is intact and smooth.",
        "The rear backing shifts slightly and its waxed edge looks freshly handled."
      ]
    }
  ],
  "visibleObjects": [
    {
      "objectBoardId": "visible-display-niche",
      "objectId": "object-display-niche",
      "label": "Display niche",
      "locationId": "loc-judge-chambers",
      "visibleDescription": "Open display niche where the gavel was kept.",
      "inspectionStatus": "mentioned",
      "turnFirstSeen": 0
    },
    {
      "objectBoardId": "visible-tea-service",
      "objectId": "object-tea-urn",
      "label": "Sideboard and tea service",
      "locationId": "loc-judge-chambers",
      "visibleDescription": "A tea service waits on the sideboard after the interrupted reception.",
      "inspectionStatus": "inspection_available",
      "turnFirstSeen": 0
    },
    {
      "objectBoardId": "visible-desk-blotter",
      "objectId": "object-desk-blotter",
      "label": "Judge's desk and blotter",
      "locationId": "loc-judge-chambers",
      "visibleDescription": "The judge's desk and blotter remain available for inspection.",
      "inspectionStatus": "inspection_available",
      "turnFirstSeen": 0
    },
    {
      "objectBoardId": "visible-ledger-shelves",
      "objectId": "object-ledger-shelves",
      "label": "Ledger shelves",
      "locationId": "loc-judge-chambers",
      "visibleDescription": "Shelves of case ledgers stand along one wall.",
      "inspectionStatus": "inspection_available",
      "turnFirstSeen": 0
    }
  ],
  "inspectedObjects": [
    {
      "inspectionBoardId": "inspect-front-lock",
      "objectId": "object-display-front-lock",
      "label": "Display niche front lock",
      "locationId": "loc-judge-chambers",
      "inspectionDepth": "inspected",
      "resultKnownToPlayer": "The front lock is intact and smooth, with no fresh scratches or forced marks.",
      "clueIdsDiscovered": ["clue-intact-front-lock"],
      "evidenceIdsDiscovered": ["evidence-display-niche"],
      "closerInspectionAvailable": false,
      "turnInspected": 1
    },
    {
      "inspectionBoardId": "inspect-display-backing",
      "objectId": "object-display-backing",
      "label": "Display niche backing",
      "locationId": "loc-judge-chambers",
      "inspectionDepth": "closely_inspected",
      "resultKnownToPlayer": "The backing shifts slightly, and its waxed edge looks freshly handled.",
      "clueIdsDiscovered": ["clue-loose-backing"],
      "evidenceIdsDiscovered": ["evidence-display-niche"],
      "closerInspectionAvailable": true,
      "turnInspected": 1
    }
  ],
  "ruledOutAreas": [
    {
      "ruledOutBoardId": "ruled-out-front-forcing",
      "locationId": "loc-judge-chambers",
      "objectId": "object-display-front-lock",
      "leadId": "lead-display-front-forced-entry",
      "label": "Forced front entry",
      "reasonKnownToPlayer": "The front lock is intact and smooth, with no fresh scratches or forced marks.",
      "turnRuledOut": 1
    }
  ],
  "recoveredEvidence": [],
  "imagesSeen": [
    {
      "imageBoardId": "image-chambers-scene",
      "imageId": null,